{"artifacts":[{"id":"artifact_problem","kind":"problem_ir","schema":"mathhead.problem-ir.v1","sha256":"367b2e835f815491ebd36e73975beadeb5a3ea27594e6aea0a7b536d8eedd43f"}],"consistency":{"basis_sha256":"d3e54241e4b950b78a1d200217d1aa1efbf361ebc99e7ce9f914197c3e4099e9","reason":"The fixture does not promote an unchecked context to consistency.","status":"unchecked"},"context_id":"context_identity","declarations":[],"direct_import_ids":[],"extensions":{},"imports":[],"namespace":"org.mathhead.fixtures","revision":{"mode":"root","number":0,"parent":null,"retired_declaration_ids":[]},"schema":"mathhead.theory-context.v1","scope":{"id":null,"kind":"theory","parent_theory_sha256":null}}
