{"artifacts":[{"id":"artifact_problem","kind":"problem_ir","schema":"mathhead.problem-ir.v1","sha256":"6a1a1b3e1f5ad55767a4d178641414ad5be3ee7718331545cd6141a58e346456"}],"consistency":{"basis_sha256":"4cc384cb6fa3ee7b471cc2fe048e22c838804b16daad58292a29a242dc2f31b6","reason":"The fixture does not promote an unchecked context to consistency.","status":"unchecked"},"context_id":"context_ambiguous","declarations":[],"direct_import_ids":[],"extensions":{},"imports":[],"namespace":"org.mathhead.fixtures","revision":{"mode":"root","number":0,"parent":null,"retired_declaration_ids":[]},"schema":"mathhead.theory-context.v1","scope":{"id":null,"kind":"theory","parent_theory_sha256":null}}
